id_evento,title_it,title_en,startDate,endDate,description_it,description_en,city,nation,subscriptionType,venue,evidenceImageUrl,presentationDescription_it,presentationDescription_en,programCover,programPDF,address,eventType,supplier,ecm,externalSubscribeLink,subscription,format
"831","Past, present and future in Pain Medicine - Second Edition","Past, present and future in Pain Medicine - Second Edition","2023-05-11 00:00:00.0","2023-05-13 23:59:59.0",,,"131","47","2","The Residence Tunis","/Portals/19/vgfm/events/831/generalinformations/6fd49e88ee4c4887ba4ea6b31447e0fe_Cover-eventi_Tunis_11-13-Maggio_x1.jpg?ver=nkNyIatoJ-R_yunU0G5kRg%3d%3d","&lt;p&gt;The 2023 decision of the Fondazione Internazionale Menarini (FIM), to organize a series of educational events dedicated to Pain Medicine has been appreciated very much. Hence, we are at the second edition just in a few weeks. &ldquo;Past, present and future in Pain Medicine&rdquo; in Cancun was a thrilling experience, especially because a structured education on Pain Medicine is still lacking in large part of the world.&lt;/p&gt;&lt;p&gt;This time we are in the Mediterranean area, cradle of deep classical cultures, and where our modern medicine was born. Historically, we could find the roots of pain medicine in most of our cultural heritages. Both Asklipios (&Alpha;&sigma;&kappa;&lambda;ή&pi;&iota;&omicron;&sigmaf;) and Hippocrates were concerned about pain of their &ldquo;patients&rdquo;, and addressed their cares to pain relief. The roots are even deeper in the Roman medicine deriving and taught by the Etruscans medicine, believed to be the best at that time because based on phytotherapy, but already including surgery. It is just useless to discuss of the advanced medicine of ancient Egypt, where the first knowledges belong to the first monarchical era (2700 BC). Herodotus was used to define the Egyptians &ldquo;people of the very healthy&rdquo;, thanks to the important health system they possessed, and to the existence of a doctor for every infirmity (first indication of specialization in the medical field, in the history of the mankind).&lt;/p&gt;&lt;p&gt;In the more recent times, the Mediterranean cradle has produced extraordinary physicians, like Tawhida&amp;nbsp;Ben Cheikh. She was born in Tunis, in 1908, and has represented a light, an illuminating beacon, an example, for all the women of her age and the future generations. She was particularly interested to the health conditions in the women, including, but not limited to the family planning, and pain in women.&lt;/p&gt;&lt;p&gt;Now, Tunis is hosting the second edition of &ldquo;Past, present and future in Pain Medicine&rdquo;, with the support of several important Colleagues, especially women, interested in Pain Medicine and devoted to reduce the sufferance of their patients. They accepted with enthusiasm the invitation of the FIM to organize an important educational event, which may represent a new experience and a driving force for the young generations. Pain Medicine deserves the maximum of our attention, because, as our Great Guru, John Bonica (born in the Mediterranean), was used to say: patients should never suffer.&lt;/p&gt;&lt;p&gt;As a responsible for the organization of the scientific program, I would deeply thank all the Colleagues and Friends, who were such for large part of my life dedicated to Pain Medicine. They have accepted with enthusiasm to participate in this event and share their knowledge with all of us. All of them are strongly convinced of the importance to exchange information and learn from others the difficult art of reducing the sufferance of the humanity.&lt;/p&gt;&lt;p&gt;As we know from recent, dramatic news, this is not always interpreted as a simple and &ldquo;transparent&rdquo; mission. When facing suffering people, it could be easy to be attracted by easy earnings. Ethics and comprehension are crucial aspects for a Pain Physician. Maybe in one of the future editions of this educational event, the program will also focuses on these aspects, and not only on the science and the evidence-based results of studies on drugs or on interventional techniques, like it is in this occasion. Who will live will see (qui vivra verra).&lt;/p&gt;&lt;p&gt;Meanwhile, we all hope that you will enjoy the efforts of the FIM to diffuse the good, ethical knowledges on Pain Medicine, and to stimulate new finalized dreams in all of us, but especially in the new generations. The Paolo Procacci Foundation, requested to help with the scientific program, has tried to do its best. We all hope that you will appreciate and enjoy it.&lt;/p&gt; &lt;p style=&quot;text-align: center;&quot;&gt;SCIENTIFIC PROGRAM COORDINATOR&lt;br /&gt; Giustino Varrassi &lt;/p&gt;","&lt;p&gt;The 2023 decision of the Fondazione Internazionale Menarini (FIM), to organize a series of educational events dedicated to Pain Medicine has been appreciated very much. Hence, we are at the second edition just in a few weeks. &ldquo;Past, present and future in Pain Medicine&rdquo; in Cancun was a thrilling experience, especially because a structured education on Pain Medicine is still lacking in large part of the world.&lt;/p&gt;&lt;p&gt;This time we are in the Mediterranean area, cradle of deep classical cultures, and where our modern medicine was born. Historically, we could find the roots of pain medicine in most of our cultural heritages. Both Asklipios (&Alpha;&sigma;&kappa;&lambda;ή&pi;&iota;&omicron;&sigmaf;) and Hippocrates were concerned about pain of their &ldquo;patients&rdquo;, and addressed their cares to pain relief. The roots are even deeper in the Roman medicine deriving and taught by the Etruscans medicine, believed to be the best at that time because based on phytotherapy, but already including surgery. It is just useless to discuss of the advanced medicine of ancient Egypt, where the first knowledges belong to the first monarchical era (2700 BC). Herodotus was used to define the Egyptians &ldquo;people of the very healthy&rdquo;, thanks to the important health system they possessed, and to the existence of a doctor for every infirmity (first indication of specialization in the medical field, in the history of the mankind).&lt;/p&gt;&lt;p&gt;In the more recent times, the Mediterranean cradle has produced extraordinary physicians, like Tawhida&amp;nbsp;Ben Cheikh. She was born in Tunis, in 1908, and has represented a light, an illuminating beacon, an example, for all the women of her age and the future generations. She was particularly interested to the health conditions in the women, including, but not limited to the family planning, and pain in women.&lt;/p&gt;&lt;p&gt;Now, Tunis is hosting the second edition of &ldquo;Past, present and future in Pain Medicine&rdquo;, with the support of several important Colleagues, especially women, interested in Pain Medicine and devoted to reduce the sufferance of their patients. They accepted with enthusiasm the invitation of the FIM to organize an important educational event, which may represent a new experience and a driving force for the young generations. Pain Medicine deserves the maximum of our attention, because, as our Great Guru, John Bonica (born in the Mediterranean), was used to say: patients should never suffer.&lt;/p&gt;&lt;p&gt;As a responsible for the organization of the scientific program, I would deeply thank all the Colleagues and Friends, who were such for large part of my life dedicated to Pain Medicine. They have accepted with enthusiasm to participate in this event and share their knowledge with all of us. All of them are strongly convinced of the importance to exchange information and learn from others the difficult art of reducing the sufferance of the humanity.&lt;/p&gt;&lt;p&gt;As we know from recent, dramatic news, this is not always interpreted as a simple and &ldquo;transparent&rdquo; mission. When facing suffering people, it could be easy to be attracted by easy earnings. Ethics and comprehension are crucial aspects for a Pain Physician. Maybe in one of the future editions of this educational event, the program will also focuses on these aspects, and not only on the science and the evidence-based results of studies on drugs or on interventional techniques, like it is in this occasion. Who will live will see (qui vivra verra).&lt;/p&gt;&lt;p&gt;Meanwhile, we all hope that you will enjoy the efforts of the FIM to diffuse the good, ethical knowledges on Pain Medicine, and to stimulate new finalized dreams in all of us, but especially in the new generations. The Paolo Procacci Foundation, requested to help with the scientific program, has tried to do its best. We all hope that you will appreciate and enjoy it.&lt;/p&gt; &lt;p style=&quot;text-align: center;&quot;&gt;SCIENTIFIC PROGRAM COORDINATOR&lt;br /&gt; Giustino Varrassi &lt;/p&gt;","/Portals/19/vgfm/events/831/the_program/cover/c71bfc4685864643bd2e3baedbb9b9bf_Programma_12-13maggio_Tunisi 17X23_27.pdf.jpg?ver=8MsfzZZ0nEzWvmArZaM7jQ%3d%3d","/Portals/19/vgfm/events/831/the_program/c71bfc4685864643bd2e3baedbb9b9bf_Programma_12-13maggio_Tunisi 17X23_27.pdf?ver=kRf6Wc-vVxreRwQOpKQiJQ%3d%3d",,"event","22",,,"healthcare","inSiteAndStreaming"
"832","HOT TOPICS IN CARDIOVASCULAR MEDICINE 2023 First edition","HOT TOPICS IN CARDIOVASCULAR MEDICINE 2023 First edition","2023-04-21 00:00:00.0","2023-04-22 23:59:59.0",,,"103","30","2","Congress Center of the Hotel Paradisus Cancun","/Portals/19/vgfm/events/832/generalinformations/58d18bff4f1143c8b29574c0c4e6e4a0_Cover-eventi_CANCUN_21-22-Apr_x1.jpg?ver=Mp0t6WtZJ5xecGMFfAWeGw%3d%3d","&lt;h2 style=&quot;text-align: center;color: #005a76;font-weight: bold;&quot;&gt;Friday 21 APRIL 2023&lt;/h2&gt; &lt;p style=&quot;text-align: center;color: #ae0f0a;font-weight: bold;&quot;&gt; SESSION I - CV RISK FACTORS&lt;br /&gt; SESSION II - HYPERTENSION &lt;br /&gt; SESSION III - HEART FAILURE&lt;br /&gt; SESSION IV - RECENT GUIDELINES IN CVD &lt;/p&gt; &lt;br /&gt; &lt;br /&gt; &lt;h2 style=&quot;text-align: center;color: #005a76;font-weight: bold;&quot;&gt;Saturday 22 APRIL 2023&lt;/h2&gt; &lt;p style=&quot;text-align: center;color: #ae0f0a;font-weight: bold;&quot;&gt; SESSION V - HOT TOPICS IN CVD I&lt;br /&gt; SESSION II - CHRONIC CORONARY SYNDROMES &lt;br /&gt; SESSION III - HOT TOPICS IN CVD II &lt;/p&gt; &lt;br /&gt; &lt;br /&gt; &lt;p style=&quot;text-align: center; color: #ae0f0a;&quot;&gt;&lt;strong&gt;&lt;span style=&quot;text-decoration: underline;&quot;&gt;CO-PRESIDENTS OF THE MEETING&lt;/span&gt;&lt;/strong&gt;&lt;/p&gt; &lt;p style=&quot;text-align: center;color: #005a76;font-weight: bold;&quot;&gt;&lt;br /&gt;&lt;/p&gt;&lt;p style=&quot;text-align: center;color: #005a76;font-weight: bold;&quot;&gt; C.Jerjes Sanchez Diaz&lt;br /&gt; C.Indolfi &lt;br /&gt; J.P. Lopez jaramillo&lt;br /&gt; P.Perroni Filardi&lt;br /&gt; G.Rosano &lt;/p&gt;&lt;p&gt;&lt;br /&gt;&lt;/p&gt;&lt;p&gt;&lt;br /&gt;&lt;/p&gt;&lt;p&gt; &lt;span style=&quot;color: #000080;&quot;&gt;Cardiovascular diseases are the leading cause of disability and mortality for global population and, despite new therapeutic options, their burden is projected to continue to increase in the next decade. Despite improved knowledge, availability of new therapies and devices and useful clinical guidelines issued by International societies, the vast majority of patients and individuals at risk are not adequately treated. There are many reasons for this including different social, financial, and health care conditions in different countries. &lt;br /&gt; It is clear that multiple risk factors have a major impact on the general population and that their multimodal modification will decrease incidence of coronary heart disease and there is eviden&amp;#x2;ce that comprehensive risk factor management results in improved clinical outcomes, increased survival and improved quality of life. Furthermore, full implementation of guideline-directed medical therapy reduces cardiovascular events and mortality but often therapeutic inertia is the cause for the under-treatment of patients with cardiovascular diseases. During two-days mee&amp;#x2;ting state of the art and future perspectives of cardiovascular medicine, including novel cardio&amp;#x2;vascular risk factors hypertension, coronary artery disease and heart failure will be discussed by a renowned international faculty. &lt;br /&gt; We look forward to welcoming an international audience in order to provide the practicing phy&amp;#x2;sician with the most up-to-date information in the latest scientific guidelines and at the same time give a comprehensive update of novel insights relevant both to the prevention and treat&amp;#x2;ment of cardiovascular diseases&lt;/span&gt;&lt;/p&gt; &lt;p style=&quot;text-align: right;&quot;&gt; &lt;strong&gt;&lt;span style=&quot;color: #000080;&quot;&gt;Prof. Carlos Jerjes Sanchez Diaz&lt;br /&gt; Prof. Ciro Indolfi&lt;br /&gt; Prof. Jose Patricio Lopez Jaramillo&lt;br /&gt; Prof. Pasquale Perroni Filardi&lt;br /&gt; Prof. Giuseppe Rosano &lt;/span&gt;&lt;/strong&gt;&lt;/p&gt;","&lt;h2 style=&quot;text-align: center;color: #005a76;font-weight: bold;&quot;&gt;Friday 21 APRIL 2023&lt;/h2&gt; &lt;p style=&quot;text-align: center;color: #ae0f0a;font-weight: bold;&quot;&gt; SESSION I - CV RISK FACTORS&lt;br /&gt; SESSION II - HYPERTENSION &lt;br /&gt; SESSION III - HEART FAILURE&lt;br /&gt; SESSION IV - RECENT GUIDELINES IN CVD &lt;/p&gt; &lt;br /&gt; &lt;br /&gt; &lt;h2 style=&quot;text-align: center;color: #005a76;font-weight: bold;&quot;&gt;Saturday 22 APRIL 2023&lt;/h2&gt; &lt;p style=&quot;text-align: center;color: #ae0f0a;font-weight: bold;&quot;&gt; SESSION V - HOT TOPICS IN CVD I&lt;br /&gt; SESSION II - CHRONIC CORONARY SYNDROMES &lt;br /&gt; SESSION III - HOT TOPICS IN CVD II &lt;/p&gt; &lt;br /&gt; &lt;br /&gt; &lt;p style=&quot;text-align: center; color: #ae0f0a; font-weight: bold;&quot;&gt;&lt;span style=&quot;text-decoration: underline;&quot;&gt;CO-PRESIDENTS OF THE MEETING&lt;/span&gt;&lt;/p&gt; &lt;p style=&quot;text-align: center;color: #005a76;font-weight: bold;&quot;&gt; C.Jerjes Sanchez Diaz&lt;br /&gt; C.Indolfi &lt;br /&gt; J.P. Lopez jaramillo&lt;br /&gt; P.Perroni Filardi&lt;br /&gt; G.Rosano &lt;/p&gt; &lt;p&gt; &lt;br /&gt;&lt;/p&gt;&lt;p&gt;&lt;span style=&quot;color: #000080;&quot;&gt;Cardiovascular diseases are the leading cause of disability and mortality for global population and, despite new therapeutic options, their burden is projected to continue to increase in the next decade. Despite improved knowledge, availability of new therapies and devices and useful clinical guidelines issued by International societies, the vast majority of patients and individuals at risk are not adequately treated. There are many reasons for this including different social, financial, and health care conditions in different countries. &lt;br /&gt; It is clear that multiple risk factors have a major impact on the general population and that their multimodal modification will decrease incidence of coronary heart disease and there is eviden&amp;#x2;ce that comprehensive risk factor management results in improved clinical outcomes, increased survival and improved quality of life. Furthermore, full implementation of guideline-directed medical therapy reduces cardiovascular events and mortality but often therapeutic inertia is the cause for the under-treatment of patients with cardiovascular diseases. During two-days mee&amp;#x2;ting state of the art and future perspectives of cardiovascular medicine, including novel cardio&amp;#x2;vascular risk factors hypertension, coronary artery disease and heart failure will be discussed by a renowned international faculty. &lt;br /&gt; We look forward to welcoming an international audience in order to provide the practicing phy&amp;#x2;sician with the most up-to-date information in the latest scientific guidelines and at the same time give a comprehensive update of novel insights relevant both to the prevention and treat&amp;#x2;ment of cardiovascular diseases&lt;/span&gt;&lt;/p&gt; &lt;p style=&quot;text-align: right;&quot;&gt; &lt;strong&gt;&lt;span style=&quot;color: #000080;&quot;&gt;Prof. Carlos Jerjes Sanchez Diaz&lt;br /&gt; Prof. Ciro Indolfi&lt;br /&gt; Prof. Jose Patricio Lopez Jaramillo&lt;br /&gt; Prof. Pasquale Perroni Filardi&lt;br /&gt; Prof. Giuseppe Rosano &lt;/span&gt;&lt;/strong&gt;&lt;/p&gt;","/Portals/19/vgfm/events/832/the_program/cover/fc30c95c2b0f4166b4ba87cddd0bdf72_Programma_21-22apr_Cancun_web.pdf.jpg?ver=snQIenwObuvaX0gcpmpw3Q%3d%3d","/Portals/19/vgfm/events/832/the_program/fc30c95c2b0f4166b4ba87cddd0bdf72_Programma_21-22apr_Cancun_web.pdf?ver=CRPAoOgIr8PndkgF2Ig7oA%3d%3d",,"event",,,,"healthcare","inSiteAndStreaming"
"833","TRANSLATIONAL RESEARCH IN PULMONARY FIBROSIS:FROM BEDSIDE TO BENCH AND BACK","TRANSLATIONAL RESEARCH IN PULMONARY FIBROSIS:FROM BEDSIDE TO BENCH AND BACK","2023-10-19 00:00:00.0","2023-10-20 23:59:59.0",,,"59","1","2","Savoia Excelsior Palace Trieste Hotel, Riva del Mandracchio, 4, 34124 Trieste, Italy",,"&lt;p&gt;Idiopathic pulmonary fibrosis (IPF) is the most common type of idiopathic interstitial pneumonia that occurs with similar frequency of several cancers (stomach, brain, and testicular), and a prognosis not so different from lung cancer. Together with this disease there are several other secondary forms of progressive pulmonary fibrosis sharing similar pathogenesis and treatment with IPF. In the recent decades a tremendous effort was made by researchers all over the world to investigate the molecular and cellular mechanisms underpinning the pathogenesis of IPF and other pulmonary fibrosing disease. The availability of two specific anti-fibrotic drugs, such as pirfenidone and nintedanib, represented almost an advancement for the management of a previously orphan and neglected disease. Obviously, there is still a great expectaction for novel more effective therapeutics raising from new disease-paradigms to prevent and even more, to revert excessive tissue scarring in the lungs. This meeting organized by the Fondazione Menarini is aimed to show which are the most promising translational investigations on pulmonary fibrosis to-date giving a look to new insight into cellular and molecular players driving pulmonary fibrosis. All we hope to identify soon specific biomarkers to facilitate diagnosis and follow-up and, at the best, to develop novel effective treatments to improve the still bad prognosis of this devastating disease.&lt;br /&gt; The historical city of Trieste will host international recognized speakers and experts in this very interesting and challenging area of research to bring new hope for the patients and physicians who care for them. &lt;/p&gt;&lt;p style=&quot;text-align: right;&quot;&gt; &lt;strong&gt;&lt;span style=&quot;color: #333399;&quot;&gt;&lt;span style=&quot;font-size: 10pt;&quot;&gt;Prof. Marco Confalonieri &lt;/span&gt;&lt;/span&gt;&lt;span style=&quot;font-size: 10pt;&quot;&gt;&lt;br /&gt;&lt;span style=&quot;color: #333399;&quot;&gt;&lt;strong style=&quot;font-family: arial, sans-serif; text-align: start; text-decoration-color: initial;&quot;&gt;&lt;span style=&quot;font-family: Arial;&quot;&gt;Prof. Sergio Harari&lt;/span&gt;&lt;/strong&gt;&lt;br /&gt;&lt;/span&gt;&lt;/span&gt;&lt;/strong&gt;&lt;/p&gt;&lt;p style=&quot;text-align: right;&quot;&gt;&lt;span style=&quot;font-size: 10pt;&quot;&gt;&lt;strong&gt;&lt;span style=&quot;color: #333399;&quot;&gt;Co-Presidents of the Meeting&lt;/span&gt;&lt;/strong&gt;&lt;/span&gt;&lt;/p&gt;","&lt;p&gt;Idiopathic pulmonary fibrosis (IPF) is the most common type of idiopathic interstitial pneumonia that occurs with similar frequency of several cancers (stomach, brain, and testicular), and a prognosis not so different from lung cancer. Together with this disease there are several other secondary forms of progressive pulmonary fibrosis sharing similar pathogenesis and treatment with IPF. In the recent decades a tremendous effort was made by researchers all over the world to investigate the molecular and cellular mechanisms underpinning the pathogenesis of IPF and other pulmonary fibrosing disease. The availability of two specific anti-fibrotic drugs, such as pirfenidone and nintedanib, represented almost an advancement for the management of a previously orphan and neglected disease. Obviously, there is still a great expectaction for novel more effective therapeutics raising from new disease-paradigms to prevent and even more, to revert excessive tissue scarring in the lungs. This meeting organized by the Fondazione Menarini is aimed to show which are the most promising translational investigations on pulmonary fibrosis to-date giving a look to new insight into cellular and molecular players driving pulmonary fibrosis. All we hope to identify soon specific biomarkers to facilitate diagnosis and follow-up and, at the best, to develop novel effective treatments to improve the still bad prognosis of this devastating disease.&lt;br /&gt; The historical city of Trieste will host international recognized speakers and experts in this very interesting and challenging area of research to bring new hope for the patients and physicians who care for them. &lt;/p&gt;&lt;p style=&quot;text-align: right;&quot;&gt; &lt;strong&gt;&lt;span style=&quot;font-size: 10pt;&quot;&gt;&lt;span style=&quot;color: #333399;&quot;&gt;Prof. Marco Confalonieri &lt;/span&gt;&lt;br /&gt;&lt;/span&gt;&lt;span style=&quot;color: #333399;&quot;&gt;&lt;strong style=&quot;font-family: arial, sans-serif; font-size: small; text-align: start; text-decoration-color: initial;&quot;&gt;&lt;span style=&quot;font-family: Arial;&quot;&gt;Prof. Sergio Harari&lt;/span&gt;&lt;/strong&gt;&lt;br /&gt;&lt;/span&gt;&lt;/strong&gt;&lt;/p&gt;&lt;p style=&quot;text-align: right;&quot;&gt;&lt;span style=&quot;font-size: 10pt;&quot;&gt;&lt;strong&gt;&lt;span style=&quot;color: #333399;&quot;&gt;Co-Presidents of the Meeting&lt;/span&gt;&lt;/strong&gt;&lt;/span&gt;&lt;/p&gt;","/Portals/19/vgfm/events/833/the_program/cover/ac9300ad02484dad9c401a67158a8189_PROGRAMMA TRIESTE OTTOBRE 2023 NEW-31.pdf.jpg?ver=86jLIPkuPnQz1SB2Cmkdww%3d%3d","/Portals/19/vgfm/events/833/the_program/ac9300ad02484dad9c401a67158a8189_PROGRAMMA TRIESTE OTTOBRE 2023 NEW-31.pdf?ver=A0IaGDyh9xOC-QkdQArC4Q%3d%3d",,"event","27",,,"healthcare","inSiteAndStreaming"
"834","Fridays for digital health","Fridays for digital health","2023-04-07 00:00:00.0","2023-04-21 23:59:59.0",,,"24","1","2",,"/Portals/19/vgfm/events/834/generalinformations/17a2dd0f48714c4fb5da3cdfc2e86495_COVER_PAG_quest_Fridays-for-digital-health_352x185.jpg?ver=X0OnzIGBwXGy207L8OsHiw%3d%3d","<p> <strong>Fridays for Digital Health</strong>&nbsp;is a project born under the endorsement of the&nbsp;<strong>World Hypertension League</strong>, co-organized by&nbsp;<strong>Fondazione Internazionale Menarini&nbsp;</strong>with technical support and organization by&nbsp;<strong>AIM Group International</strong>. </p> <p> The purpose of this project is to discuss about the impact that&nbsp;<strong>digital health</strong>&nbsp;– which includes categories such as mobile health (mHealth), health information technology (IT), artificial intelligence (AI), wearable devices, telehealth, telemedicine and personalized medicine – could have on medical field. </p> <p> A profiling questionnaire will be available&nbsp;<strong>from Friday, April 7th, until Wednesday, April 12th</strong>. After taking the questionnaire, users can enjoy a personalized scientific path enriched with a thematic webinar, infographic and a special invitation for a live event! </p> <p> Click on the link to take the questionnaire and get ready to start your journey across digital health!</p><p><br /></p><p><a href="https://www.aimphygital.com/events/728ae482-0c5b-41b7-b6e1-3bf96fc25bf8" target="_blank">https://www.aimphygital.com/events/728ae482-0c5b-41b7-b6e1-3bf96fc25bf8</a><br /></p>","&lt;p&gt;&lt;strong&gt;Fridays for Digital Health&lt;/strong&gt;&amp;nbsp;is a project born under the endorsement of the&amp;nbsp;&lt;strong&gt;World Hypertension League&lt;/strong&gt;, co-organized by&amp;nbsp;&lt;strong&gt;Fondazione Internazionale Menarini&amp;nbsp;&lt;/strong&gt;with technical support and organization by&amp;nbsp;&lt;strong&gt;AIM Group International&lt;/strong&gt;.&lt;/p&gt;&lt;p&gt;The purpose of this project is to discuss about the impact that&amp;nbsp;&lt;strong&gt;digital health&lt;/strong&gt;&amp;nbsp;&ndash; which includes categories such as mobile health (mHealth), health information technology (IT), artificial intelligence (AI), wearable devices, telehealth, telemedicine and personalized medicine &ndash; could have on medical field.&lt;/p&gt;&lt;p&gt;A profiling questionnaire will be available&amp;nbsp;&lt;strong&gt;from Friday, April 7th, until Wednesday, April 12th&lt;/strong&gt;. After taking the questionnaire, users can enjoy a personalized scientific path enriched with a thematic webinar, infographic and a special invitation for a live event!&lt;/p&gt;&lt;p&gt;Click on the link to take the questionnaire and get ready to start your journey across digital health!&lt;/p&gt;&lt;p&gt;&lt;br /&gt;&lt;/p&gt;&lt;p&gt;&lt;a href=&quot;https://www.aimphygital.com/events/728ae482-0c5b-41b7-b6e1-3bf96fc25bf8&quot; target=&quot;_blank&quot;&gt;https://www.aimphygital.com/events/728ae482-0c5b-41b7-b6e1-3bf96fc25bf8&lt;/a&gt;&lt;br /&gt;&lt;/p&gt;",,,,"event",,,,"none",
