id_evento,title_it,title_en,startDate,endDate,description_it,description_en,city,nation,subscriptionType,venue,evidenceImageUrl,presentationDescription_it,presentationDescription_en,programCover,programPDF,address,eventType,supplier,ecm,externalSubscribeLink,subscription,format
"773","Educational Webinars in conjuction with the development of the H. Pylori - Consensus Meeting Maastricht VI/Florence - 3","Educational Webinars in conjuction with the development of the H. Pylori - Consensus Meeting Maastricht VI/Florence - 3","2021-06-15 00:00:00.0","2021-06-15 23:59:59.0",,,,,"2",,"/Portals/19/vgfm/events/773/generalinformations/14a546e5d20a4d2eb68cedd798e67f3a_Hpylori_copertina_15june-WEB.jpg?ver=FFccZvQWlHxgQVswPAtlGg%3d%3d","&lt;p style=&quot;text-align: center; font-size: 14pt;&quot;&gt;&lt;strong&gt;Educational events in the context of the H. pylori Consensus development&lt;/strong&gt;&lt;/p&gt; &lt;p style=&quot;text-align: center; font-family: Arial; font-size: 14pt; color: #993300;&quot;&gt; &lt;strong&gt;18&lt;sup&gt;th&lt;/sup&gt; May 2021 - h. 16.00 - 18.00 (CEST)&lt;/strong&gt;&lt;br /&gt; &lt;strong&gt;3&lt;sup&gt;rd&lt;/sup&gt; June 2021 - h. 16.00 - 18.00 (CEST)&lt;/strong&gt;&lt;br /&gt; &lt;strong&gt;15&lt;sup&gt;th&lt;/sup&gt; June 2021 - h. 16.00 - 18.00 (CEST)&lt;/strong&gt;&lt;br /&gt; &lt;strong&gt;29&lt;sup&gt;th&lt;/sup&gt; June 2021 - h. 16.00 - 18.00 (CEST)&lt;/strong&gt; &lt;/p&gt; &lt;p&gt; This year is the 25th anniversary since the first H. pylori Consensus report held in Maastricht in 1996. &lt;/p&gt; &lt;p&gt; We are now working on the 6th consensus edition (Maastricht VI//Florence) with a group of dedicated clinical experts and scientists, focussing on this continuously growing and expanding field. &lt;/p&gt; &lt;p&gt; H.pylori is unique in its pathogenic relationship with the stomach which has diverse clinical outcomes due to a series of other interfering factors. Ever since its discovery, H. pylori has aroused great scientific interest with controversial opinions involving numerous medical disciplines, and it has become an exemplary model because of its medical multi- and interdisciplinarity. &lt;/p&gt; &lt;p&gt; For this reason we believe that in the context of the H. pylori Consensus development, which combines a challenging academic exercise with the demand to come up with useful clinical guidance, a series of accompanying webinars would be useful for educational purposes in clinical medicine and related scientific disciplines. &lt;/p&gt; &lt;p&gt; The contents of these educational webinars will include methodological aspects on how to select relevant questions, provide evidence, proceed with the assessment of individual statements, deal with controversies, and finally, on how to reach a consensus. &lt;/p&gt; &lt;p&gt; Authoritative experts in the H. pylori field will give concise presentations with up-to-date knowledge on clinical scenarios, diagnostic procedures, therapeutic strategies, preventive measures, and the interaction of H. pylori with the gut microbiota. Specific aspects, such as the role of H. pylori eradication in patients with myocardial infarction, and H. pylori related clinical challenges in times of COVID-19, will add important actuality to our endeavours. &lt;/p&gt; &lt;p&gt; We hope to stimulate your curiosity and interest to follow the webinars accompanying the H. pylori consensus development in the aim of benefitting your daily clinical and academic practice. &lt;/p&gt; &lt;p&gt; &lt;em&gt;Course Coordinator:&lt;/em&gt;&lt;br /&gt; &lt;strong&gt;P. Malfertheiner&lt;/strong&gt;&lt;br /&gt; Otto-von-Guericke Universit&auml;t&lt;br /&gt; LMU-Universit&auml;tsklinikum , Med. Klinik II&lt;br /&gt; M&uuml;nchen, DE &lt;/p&gt;","&lt;p style=&quot;text-align: center; font-size: 14pt;&quot;&gt;&lt;strong&gt;Educational events in the context of the H. pylori Consensus development&lt;/strong&gt;&lt;/p&gt; &lt;p style=&quot;text-align: center; font-family: Arial; font-size: 14pt; color: #993300;&quot;&gt; &lt;strong&gt;18&lt;sup&gt;th&lt;/sup&gt; May 2021 - h. 16.00 - 18.00 (CEST)&lt;/strong&gt;&lt;br /&gt; &lt;strong&gt;3&lt;sup&gt;rd&lt;/sup&gt; June 2021 - h. 16.00 - 18.00 (CEST)&lt;/strong&gt;&lt;br /&gt; &lt;strong&gt;15&lt;sup&gt;th&lt;/sup&gt; June 2021 - h. 16.00 - 18.00 (CEST)&lt;/strong&gt;&lt;br /&gt; &lt;strong&gt;29&lt;sup&gt;th&lt;/sup&gt; June 2021 - h. 16.00 - 18.00 (CEST)&lt;/strong&gt; &lt;/p&gt; &lt;p&gt; This year is the 25th anniversary since the first H. pylori Consensus report held in Maastricht in 1996. &lt;/p&gt; &lt;p&gt; We are now working on the 6th consensus edition (Maastricht VI//Florence) with a group of dedicated clinical experts and scientists, focussing on this continuously growing and expanding field. &lt;/p&gt; &lt;p&gt; H.pylori is unique in its pathogenic relationship with the stomach which has diverse clinical outcomes due to a series of other interfering factors. Ever since its discovery, H. pylori has aroused great scientific interest with controversial opinions involving numerous medical disciplines, and it has become an exemplary model because of its medical multi- and interdisciplinarity. &lt;/p&gt; &lt;p&gt; For this reason we believe that in the context of the H. pylori Consensus development, which combines a challenging academic exercise with the demand to come up with useful clinical guidance, a series of accompanying webinars would be useful for educational purposes in clinical medicine and related scientific disciplines. &lt;/p&gt; &lt;p&gt; The contents of these educational webinars will include methodological aspects on how to select relevant questions, provide evidence, proceed with the assessment of individual statements, deal with controversies, and finally, on how to reach a consensus. &lt;/p&gt; &lt;p&gt; Authoritative experts in the H. pylori field will give concise presentations with up-to-date knowledge on clinical scenarios, diagnostic procedures, therapeutic strategies, preventive measures, and the interaction of H. pylori with the gut microbiota. Specific aspects, such as the role of H. pylori eradication in patients with myocardial infarction, and H. pylori related clinical challenges in times of COVID-19, will add important actuality to our endeavours. &lt;/p&gt; &lt;p&gt; We hope to stimulate your curiosity and interest to follow the webinars accompanying the H. pylori consensus development in the aim of benefitting your daily clinical and academic practice. &lt;/p&gt; &lt;p&gt; &lt;em&gt;Course Coordinator:&lt;/em&gt;&lt;br /&gt; &lt;strong&gt;P. Malfertheiner&lt;/strong&gt;&lt;br /&gt; Otto-von-Guericke Universit&auml;t&lt;br /&gt; LMU-Universit&auml;tsklinikum , Med. Klinik II&lt;br /&gt; M&uuml;nchen, DE &lt;/p&gt;","/Portals/19/vgfm/events//the_program/cover/fce1fd40b2f54a04a973108ee9f4226a_HPylori2021-programma.pdf.jpg?ver=y6fm4rxugKyRqjEt1Hpa5w%3d%3d","/Portals/19/vgfm/events//the_program/fce1fd40b2f54a04a973108ee9f4226a_HPylori2021-programma.pdf?ver=Dn4FjpAt5gAmjdIIGZVdXA%3d%3d",,"event","16",,,"healthcare","inSiteAndStreaming"
"774","Educational Webinars in conjuction with the development of the H. Pylori - Consensus Meeting Maastricht VI/Florence - 4","Educational Webinars in conjuction with the development of the H. Pylori - Consensus Meeting Maastricht VI/Florence - 4","2021-06-29 00:00:00.0","2021-06-29 23:59:59.0",,,,,"2",,"/Portals/19/vgfm/events/774/generalinformations/294f546c47384bd78e1c0b4b80f1654b_Hpylori_copertina_29june-WEB.jpg?ver=fbAyEuNghHg8SeTULIdd9g%3d%3d","&lt;p style=&quot;text-align: center; font-size: 14pt;&quot;&gt;&lt;strong&gt;Educational events in the context of the H. pylori Consensus development&lt;/strong&gt;&lt;/p&gt; &lt;p style=&quot;text-align: center; font-family: Arial; font-size: 14pt; color: #993300;&quot;&gt; &lt;strong&gt;18&lt;sup&gt;th&lt;/sup&gt; May 2021 - h. 16.00 - 18.00 (CEST)&lt;/strong&gt;&lt;br /&gt; &lt;strong&gt;3&lt;sup&gt;rd&lt;/sup&gt; June 2021 - h. 16.00 - 18.00 (CEST)&lt;/strong&gt;&lt;br /&gt; &lt;strong&gt;15&lt;sup&gt;th&lt;/sup&gt; June 2021 - h. 16.00 - 18.00 (CEST)&lt;/strong&gt;&lt;br /&gt; &lt;strong&gt;29&lt;sup&gt;th&lt;/sup&gt; June 2021 - h. 16.00 - 18.00 (CEST)&lt;/strong&gt; &lt;/p&gt; &lt;p&gt; This year is the 25th anniversary since the first H. pylori Consensus report held in Maastricht in 1996. &lt;/p&gt; &lt;p&gt; We are now working on the 6th consensus edition (Maastricht VI//Florence) with a group of dedicated clinical experts and scientists, focussing on this continuously growing and expanding field. &lt;/p&gt; &lt;p&gt; H.pylori is unique in its pathogenic relationship with the stomach which has diverse clinical outcomes due to a series of other interfering factors. Ever since its discovery, H. pylori has aroused great scientific interest with controversial opinions involving numerous medical disciplines, and it has become an exemplary model because of its medical multi- and interdisciplinarity. &lt;/p&gt; &lt;p&gt; For this reason we believe that in the context of the H. pylori Consensus development, which combines a challenging academic exercise with the demand to come up with useful clinical guidance, a series of accompanying webinars would be useful for educational purposes in clinical medicine and related scientific disciplines. &lt;/p&gt; &lt;p&gt; The contents of these educational webinars will include methodological aspects on how to select relevant questions, provide evidence, proceed with the assessment of individual statements, deal with controversies, and finally, on how to reach a consensus. &lt;/p&gt; &lt;p&gt; Authoritative experts in the H. pylori field will give concise presentations with up-to-date knowledge on clinical scenarios, diagnostic procedures, therapeutic strategies, preventive measures, and the interaction of H. pylori with the gut microbiota. Specific aspects, such as the role of H. pylori eradication in patients with myocardial infarction, and H. pylori related clinical challenges in times of COVID-19, will add important actuality to our endeavours. &lt;/p&gt; &lt;p&gt; We hope to stimulate your curiosity and interest to follow the webinars accompanying the H. pylori consensus development in the aim of benefitting your daily clinical and academic practice. &lt;/p&gt; &lt;p&gt; &lt;em&gt;Course Coordinator:&lt;/em&gt;&lt;br /&gt; &lt;strong&gt;P. Malfertheiner&lt;/strong&gt;&lt;br /&gt; Otto-von-Guericke Universit&auml;t&lt;br /&gt; LMU-Universit&auml;tsklinikum , Med. Klinik II&lt;br /&gt; M&uuml;nchen, DE &lt;/p&gt;","&lt;p style=&quot;text-align: center; font-size: 14pt;&quot;&gt;&lt;strong&gt;Educational events in the context of the H. pylori Consensus development&lt;/strong&gt;&lt;/p&gt; &lt;p style=&quot;text-align: center; font-family: Arial; font-size: 14pt; color: #993300;&quot;&gt; &lt;strong&gt;18&lt;sup&gt;th&lt;/sup&gt; May 2021 - h. 16.00 - 18.00 (CEST)&lt;/strong&gt;&lt;br /&gt; &lt;strong&gt;3&lt;sup&gt;rd&lt;/sup&gt; June 2021 - h. 16.00 - 18.00 (CEST)&lt;/strong&gt;&lt;br /&gt; &lt;strong&gt;15&lt;sup&gt;th&lt;/sup&gt; June 2021 - h. 16.00 - 18.00 (CEST)&lt;/strong&gt;&lt;br /&gt; &lt;strong&gt;29&lt;sup&gt;th&lt;/sup&gt; June 2021 - h. 16.00 - 18.00 (CEST)&lt;/strong&gt; &lt;/p&gt; &lt;p&gt; This year is the 25th anniversary since the first H. pylori Consensus report held in Maastricht in 1996. &lt;/p&gt; &lt;p&gt; We are now working on the 6th consensus edition (Maastricht VI//Florence) with a group of dedicated clinical experts and scientists, focussing on this continuously growing and expanding field. &lt;/p&gt; &lt;p&gt; H.pylori is unique in its pathogenic relationship with the stomach which has diverse clinical outcomes due to a series of other interfering factors. Ever since its discovery, H. pylori has aroused great scientific interest with controversial opinions involving numerous medical disciplines, and it has become an exemplary model because of its medical multi- and interdisciplinarity. &lt;/p&gt; &lt;p&gt; For this reason we believe that in the context of the H. pylori Consensus development, which combines a challenging academic exercise with the demand to come up with useful clinical guidance, a series of accompanying webinars would be useful for educational purposes in clinical medicine and related scientific disciplines. &lt;/p&gt; &lt;p&gt; The contents of these educational webinars will include methodological aspects on how to select relevant questions, provide evidence, proceed with the assessment of individual statements, deal with controversies, and finally, on how to reach a consensus. &lt;/p&gt; &lt;p&gt; Authoritative experts in the H. pylori field will give concise presentations with up-to-date knowledge on clinical scenarios, diagnostic procedures, therapeutic strategies, preventive measures, and the interaction of H. pylori with the gut microbiota. Specific aspects, such as the role of H. pylori eradication in patients with myocardial infarction, and H. pylori related clinical challenges in times of COVID-19, will add important actuality to our endeavours. &lt;/p&gt; &lt;p&gt; We hope to stimulate your curiosity and interest to follow the webinars accompanying the H. pylori consensus development in the aim of benefitting your daily clinical and academic practice. &lt;/p&gt; &lt;p&gt; &lt;em&gt;Course Coordinator:&lt;/em&gt;&lt;br /&gt; &lt;strong&gt;P. Malfertheiner&lt;/strong&gt;&lt;br /&gt; Otto-von-Guericke Universit&auml;t&lt;br /&gt; LMU-Universit&auml;tsklinikum , Med. Klinik II&lt;br /&gt; M&uuml;nchen, DE &lt;/p&gt;","/Portals/19/vgfm/events/774/the_program/cover/e659bcb4ff4243e2af31697bdf486544_HPylori2021-programma.pdf.jpg?ver=H6zC1k7XEsBVzzO4IVEFRA%3d%3d","/Portals/19/vgfm/events/774/the_program/e659bcb4ff4243e2af31697bdf486544_HPylori2021-programma.pdf?ver=6PzRUxiDNgXwym_YmBc9IQ%3d%3d",,"event","16",,,"healthcare","inSiteAndStreaming"
"775","Management of Neuroendocrine Tumours - Pathway","Management of Neuroendocrine Tumours - Pathway","2020-12-01 00:00:00.0","2022-09-17 23:59:59.0",,,,,"2",,"/Portals/19/vgfm/events/726/generalinformations/7fd239951c9c4838ab4977526b3165fd_MicrosoftTeams-image.png?ver=fi9kf4E9P-c9aNCfPcizzQ%3d%3d","&lt;p style=&quot;font-size: small;&quot;&gt;&lt;strong style=&quot;font-size: 24px;&quot;&gt;&lt;span style=&quot;color: #993300;&quot;&gt;&lt;/span&gt;&lt;/strong&gt;&lt;/p&gt;&lt;div style=&quot;text-align: center;&quot;&gt;&lt;strong style=&quot;font-size: 24px;&quot;&gt;&lt;a href=&quot;https://www.e-eso.net/pathways/65&quot; target=&quot;_blank&quot;&gt;&lt;img src=&quot;/Portals/19/vgfm/HtmlEditorFondazione/ondemand-liveStreaming-ICON.jpg&quot; alt=&quot;&quot; /&gt;&lt;/a&gt;&lt;/strong&gt;&lt;/div&gt;&lt;p&gt;&lt;strong style=&quot;font-size: 24px;&quot;&gt;&lt;span style=&quot;color: #993300;&quot;&gt;TARGET: Oncology&lt;/span&gt;&lt;/strong&gt;&lt;br /&gt;&lt;/p&gt;&lt;p&gt;&lt;strong style=&quot;font-size: 24px;&quot;&gt;&lt;span style=&quot;color: #993300;&quot;&gt;With CME accreditation&lt;/span&gt;&lt;/strong&gt;&lt;/p&gt;&lt;p&gt;&lt;br /&gt;&lt;/p&gt;&lt;p style=&quot;font-size: small;&quot;&gt;&lt;strong style=&quot;font-size: 24px;&quot;&gt;&lt;span style=&quot;color: #993300;&quot;&gt;HOW TO PARTICIPATE&lt;/span&gt;&lt;/strong&gt;&lt;/p&gt;&lt;p style=&quot;font-size: small; text-align: center;&quot;&gt;&lt;br /&gt;&lt;/p&gt;&lt;p style=&quot;font-size: small; text-align: center;&quot;&gt;&lt;span style=&quot;font-size: 14pt;&quot;&gt;&lt;strong&gt;Click here to subscribe to the online pathway:&lt;/strong&gt;&lt;/span&gt;&lt;/p&gt;&lt;p style=&quot;text-align: center;&quot;&gt;&lt;a href=&quot;https://www.e-eso.net/pathways/65&quot; target=&quot;_blank&quot; class=&quot;dnnPrimaryAction&quot;&gt;CLICK HERE&lt;/a&gt;&lt;/p&gt;&lt;p&gt;&lt;br /&gt;&lt;br /&gt;&lt;/p&gt;&lt;p&gt;&lt;br /&gt;&lt;/p&gt;&lt;p&gt;&lt;strong style=&quot;font-size: 24px;&quot;&gt;&lt;span style=&quot;color: #993300;&quot;&gt;SAVE THE DATE:&lt;/span&gt;&lt;/strong&gt;&lt;/p&gt;&lt;p&gt;&lt;strong style=&quot;font-size: 24px;&quot;&gt;&lt;span style=&quot;color: #993300;&quot;&gt;&lt;img src=&quot;/Portals/19/vgfm/HtmlEditorFondazione/NeuroendocrineTumors_24maggio.jpg&quot; alt=&quot;&quot; /&gt;&lt;br /&gt;&lt;/span&gt;&lt;/strong&gt;&lt;/p&gt;","&lt;p style=&quot;font-size: small;&quot;&gt;&lt;strong style=&quot;font-size: 24px;&quot;&gt;&lt;span style=&quot;color: #993300;&quot;&gt;&lt;/span&gt;&lt;/strong&gt;&lt;/p&gt;&lt;div style=&quot;text-align: center;&quot;&gt;&lt;div&gt;&lt;strong style=&quot;font-size: 24px;&quot;&gt;&lt;a href=&quot;https://www.e-eso.net/pathways/65&quot; target=&quot;_blank&quot;&gt;&lt;img src=&quot;https://www.fondazione-menarini.it/Portals/19/vgfm/HtmlEditorFondazione/ondemand-liveStreaming-ICON.jpg&quot; alt=&quot;&quot; /&gt;&lt;/a&gt;&lt;/strong&gt;&lt;/div&gt;&lt;p style=&quot;text-align: start;&quot;&gt;&lt;strong style=&quot;font-size: 24px;&quot;&gt;&lt;span style=&quot;color: #993300;&quot;&gt;TARGET: Oncology&lt;/span&gt;&lt;/strong&gt;&lt;br /&gt;&lt;/p&gt;&lt;p style=&quot;text-align: start;&quot;&gt;&lt;strong style=&quot;font-size: 24px;&quot;&gt;&lt;span style=&quot;color: #993300;&quot;&gt;With CME accreditation&lt;/span&gt;&lt;/strong&gt;&lt;/p&gt;&lt;p style=&quot;text-align: start;&quot;&gt;&lt;br /&gt;&lt;/p&gt;&lt;p style=&quot;text-align: start; font-size: small;&quot;&gt;&lt;strong style=&quot;font-size: 24px;&quot;&gt;&lt;span style=&quot;color: #993300;&quot;&gt;HOW TO PARTICIPATE&lt;/span&gt;&lt;/strong&gt;&lt;/p&gt;&lt;p style=&quot;font-size: small;&quot;&gt;&lt;br /&gt;&lt;/p&gt;&lt;p style=&quot;font-size: small;&quot;&gt;&lt;span style=&quot;font-size: 14pt;&quot;&gt;&lt;strong&gt;Click here to subscribe to the online pathway:&lt;/strong&gt;&lt;/span&gt;&lt;/p&gt;&lt;p&gt;&lt;a href=&quot;https://www.e-eso.net/pathways/65&quot; target=&quot;_blank&quot; class=&quot;dnnPrimaryAction&quot;&gt;CLICK HERE&lt;/a&gt;&lt;/p&gt;&lt;p style=&quot;text-align: start;&quot;&gt;&lt;br /&gt;&lt;br /&gt;&lt;/p&gt;&lt;p style=&quot;text-align: start;&quot;&gt;&lt;br /&gt;&lt;/p&gt;&lt;p style=&quot;text-align: start;&quot;&gt;&lt;strong style=&quot;font-size: 24px;&quot;&gt;&lt;span style=&quot;color: #993300;&quot;&gt;SAVE THE DATE:&lt;/span&gt;&lt;/strong&gt;&lt;/p&gt;&lt;p style=&quot;text-align: start;&quot;&gt;&lt;strong style=&quot;font-size: 24px;&quot;&gt;&lt;span style=&quot;color: #993300;&quot;&gt;&lt;img src=&quot;/Portals/19/vgfm/HtmlEditorFondazione/NeuroendocrineTumors_24maggio.jpg&quot; alt=&quot;&quot; /&gt;&lt;/span&gt;&lt;/strong&gt;&lt;/p&gt;&lt;br /&gt;&lt;/div&gt;","/Portals/19/vgfm/events/775/the_program/cover/d8415a7477ee4487a939b3db1c3af93b_PathwayNeuroendocrineTumors-programma.pdf.jpg?ver=7tBzo7EnE4GWEECtig4Iiw%3d%3d","/Portals/19/vgfm/events/775/the_program/d8415a7477ee4487a939b3db1c3af93b_PathwayNeuroendocrineTumors-programma.pdf?ver=2P77ozI7UlGnt8fPu2V3hg%3d%3d",,"course",,"With CME accreditation",,"none",
"776","Breast Cancer in the Elderly","Breast Cancer in the Elderly","2021-10-01 00:00:00.0","2021-10-02 23:59:59.0",,,,,"2",,"/Portals/19/vgfm/events/776/generalinformations/3fdc1cc83be94057b904da2f8ee89e3c_banner.jpg?ver=ADo3ZwAgLdGIBTE5oS-tiA%3d%3d","&lt;p&gt;Breast cancer management in older patients can be challenging and requires calibrated and weighted risk-benefit decision making. Despite breast cancer being a common disease in older women, few evidence-based recommendations exist upon which oncologists can ground their clinical decisions. The course will handle breast cancer management in older patients from different perspectives, from the place older people have in our society to the characterization and needs of older patients according to different health professional specialties including patients&rsquo; advocates. Specific diagnostic and treatment scenarios and controverses will be discussed and debated emphasizing the most relevant pending questions and new evidence. The overall aim is to provide a broad panorama on how to address the complexity of different disease settings in older patients and to help clinicians to understand and select the best available choices in routine clinical practice, when sitting in a multidisciplinary meeting or in front of the patient according.&lt;br /&gt;&lt;/p&gt;&lt;p&gt;&lt;strong&gt;Laura Biganzoli and Olivia Pagani&lt;/strong&gt;&lt;/p&gt;&lt;p&gt;&lt;br /&gt;&lt;/p&gt;&lt;p&gt;&lt;br /&gt;&lt;/p&gt;","Breast cancer management in older patients can be challenging and requires calibrated and weighted risk-benefit decision making. Despite breast cancer being a common disease in older women, few evidence-based recommendations exist upon which oncologists can ground their clinical decisions. The course will handle breast cancer management in older patients from different perspectives, from the place older people have in our society to the characterization and needs of older patients according to different health professional specialties including patients’ advocates. Specific diagnostic and treatment scenarios and controverses will be discussed and debated emphasizing the most relevant pending questions and new evidence. The overall aim is to provide a broad panorama on how to address the complexity of different disease settings in older patients and to help clinicians to understand and select the best available choices in routine clinical practice, when sitting in a multidisciplinary meeting or in front of the patient according.<p> <strong>Laura Biganzoli and Olivia Pagani</strong> </p>","/Portals/19/vgfm/events/776/the_program/cover/c1728cf623264f7cb4a2f186583357b8_BreastCancerInTheElder1-2Ottobre2021-programma.pdf.jpg?ver=t8Xl5pp2ywtgSFdTwWLu0w%3d%3d","/Portals/19/vgfm/events/776/the_program/c1728cf623264f7cb4a2f186583357b8_BreastCancerInTheElder1-2Ottobre2021-programma.pdf?ver=RKOPBnstIfC5kDsT80kNYg%3d%3d",,"course",,"5",,"none",
